,job_title,job_link,job_desc
105,Site Reliability Engineer(1390514),https://jobs.cisco.com/jobs/ProjectDetail/Site-Reliability-Engineer-1390514/1390514," Participate in Agile Scrum Accountability for system reliability right from design to end of life. Automate operational capabilities using Python, Ansible, Terraform, Go etc. Deliver automation through CI/CD pipeline and chatbot etc. Rotation in on call duties like diagnosis, fix and RCA for incidents and support escalations. Improvement and responsibility for monitoring and alerting Experience in managing Enterprise Grade Kubernetes cluster (RH OpenShift – preferred) & Anthos. Experience working with Public Cloud offerings (AWS, GCP) Advanced knowledge of Kubernetes, Dockers, Terraform, Ansible, Jenkins, GitOps, Git, Linux Software development lifecycle includes design, development, testing, packaging, deployment using Python or Golang Preferred: Kubernetes, OpenShift experience or certification Agile software development practices, JIRA Work with geographically distributed teams Understand IT processes, including architecture, design, implementation, and operations Self-motivated, able, and willing to help where help is needed Able to build and establish relationships, be culturally sensitive, have goal alignment and learning agility Have a knack for always finding automation opportunities within the team"
106,Cisco Meraki - Director of Product Management - Developer Platform and Ecosystem,https://jobs.cisco.com/jobs/ProjectDetail/Cisco-Meraki-Director-of-Product-Management-Developer-Platform-and-Ecosystem/1390510," Define the strategy for the Meraki API framework, API features, developer platform, and partner ecosystem Grow our app marketplace, open source projects, product integrations, in breadth and depth Develop a playbook for strategic partnerships with key technology partners and work with business development and partner sales teams to grow these relationships Discover and prioritize customer use cases and requirements to define the strategy for our API first strategy across the Meraki platform Work closely with our engineers, solutions architects, developer advocates to continue to simplify our outstanding developer and customer experience Team up with our rapidly growing sales teams and partners to solve customer problems 10+ years of experience in a Product Management role 5+ years of experience in developer platforms, app marketplaces, and API products 5+ years of people management experience building, leading and mentoring high performing teams Technical background working with engineering teams on complex software projects Experience with enterprise SaaS software Expertise in product analytics (product engagement/adoption, app marketplaces) You have a real dedication for learning about networking, cloud, and emerging ground-breaking technologies You have a strong sense of customer empathy to care deeply about top customer problems You are able to easily communicate complicated concepts simply to multiple audiences You have a results-oriented, can-do demeanor with an intuitive understanding of product quality You love solving technical problems in innovative ways BA/BS in Computer Science, Information Systems, Engineering or related degree"
107,Product Designer,https://jobs.cisco.com/jobs/ProjectDetail/Product-Designer/1390412," Design features and interactions for the Cloud Security group of products that are easy to use and understand. Conduct customer and user research  Produce artifacts such as interaction flows and mock-ups to support development and rapid iteration Create and maintain personas and use cases in order to frame and validate your design work Create and conduct usability tests Work to strengthen UX process and evangelize UX within Cisco Cloud Security 3-5 years of experience in user experience design. Experience in designing web-based applications for complex enterprise needs. Ability to guide complex features from initial concept to production and post-launch evaluation. Current knowledge of web technologies, tools, and trends. Working knowledge of common design tools such as Figma Excellent visualization skills with the ability to clearly articulate concepts visually and verbally. Please include a link to your portfolio when applying."
108,Backend Engineer (NETA),https://jobs.cisco.com/jobs/ProjectDetail/Backend-Engineer-NETA/1390406," Design, develop, scale up backend services and infrastructure that enable internet access for millions of people and devices around the globe. Refactor our monolith and re-envision our services as we evolve our systems towards independent, containerized services. Collaborate with globally-distributed teams on projects that span numerous domains — networking, databases, web app development, systems Make an immediate and significant difference to the hundreds of millions of users who rely on our services for internet access every single day. Refactoring frameworks/libraries and creating an internal API with a simple, unified interface for other developers to work with access policies. Scaling up our backend services to handle 10x the load they can today. You could help us rethink the way we do sharding and load-balancing and make our infrastructure elastic. Ensuring data consistency across our full stack – 1) Meraki devices, 2) backend data services and 3) Meraki Dashboard web application. It’s like a large distributed storage system that supports our global customer base. Introducing exhaustive code quality metrics and standards as well as defining service level expectations for our services. You like thinking about whole systems — from trade-offs in design to edge cases and failure scenarios. Experience in some form of backend software development at scale: distributed systems, databases, platform engineering, data processing or similar. Have a focused, organized approach to design, implementation, testing, and quality. Know your way around at least one of the languages we use: Scala, Ruby, C/C++, Go. You embrace the idea of being language-agnostic. Experience with SQL and any RDBMS. Excellent communication skills (our team is distributed across several time zones). Interest in general security and/or data privacy and/or zero-trust networks is a plus. You’re excited about solving scalability challenges both on the organisational and technology levels. Personal projects or contributions to open-source. Mentorship or leadership experience. A supportive and fun environment and a team that values your contributions and helps you grow; regular career conversations. A lot of opportunities for professional and personal growth via employee-led groups and mentorship programs. Check out one of our groups — Women of Meraki on Twitter and Instagram. Meaningful and candid feedback on a regular basis following Radical Candor. Paid time off to volunteer (5 days a year), and much more. A great in-office experience: delicious catered meals every day and fully-stocked kitchens and all you can eat snacks."
109,"Financial Analyst, CX Finance",https://jobs.cisco.com/jobs/ProjectDetail/Financial-Analyst-CX-Finance/1390386," Reporting and working with the CX Renewals Business Partners for Opex, HC, and Spend Management and modeling out spend management for key investment activities. Consolidating the Renewals Bookings and Renewal Rate forecasting. Preparing and reviewing forecasts with management teams for both Finance and Business Partners. Planning – work with CX Strategy & Planning to drive the annual planning cycle for Opex for the CX Renewals team. Provide mentorship, recommendations, and business models to achieve business outcomes and handle to the spend targets Define the future models for forecasting and reporting. Develop the processes to operationalize both forecasting and reporting. Work with CX Sales Operations. Help CX leadership interpret analytics, gain insights, and understand key trends in the business. B.S. in Finance 3-5 years working in Finance (high-tech proven experience is a plus) Strong problem-solving skills Data Analytics and Financial Models High proficiency with Microsoft Office. Must be highly motivated; able to handle several tasks. Excellent analytical, problem-solving skills and attention to detail Strong interpersonal, teamwork, and communication skills"
110,Sr Finance Customs Analyst,https://jobs.cisco.com/jobs/ProjectDetail/Sr-Finance-Customs-Analyst/1390413," Formalize processes that facilitate Duty Drawback claims. Collaborate with Sales to identify flows that are eligible for Duty Drawback based on export flow Coordinate work of Drawback Service provider to ensure claims are filed timely and accurately Perform audits on potential claims, including creation of presentations and effectively communicate results Engage data driven conversations with management as well as business partners and provide explanation to variances Work with Cross Functional teams and Data Scientists to collect meaningful data in support of Drawback initiatives. Deliver comprehensive status reports to leadership. 2 to 3 years minimum of Customs compliance experience  U.S. Customs Broker license recommended but not required  Ability to research customs regulations  Strong problem solving skills  Strong communication skills  Intermediate to advanced experience in MS Excel  Knowledge of FinBI, Agile, CCW, Virtual Trader, Oracle is recommended"
111,Technical Consulting Engineer- AAA/ISE (1390203),https://jobs.cisco.com/jobs/ProjectDetail/Technical-Consulting-Engineer-AAA-ISE-1390203/1390203," Provide customer technical support. Participate in daytime and night/weekend on-call rotation. Troubleshoot Wireless LAN networks to quickly resolve and minimize downtime and outages. Recommend technical solutions to improve customer operations. Maintain CRM database for active issues. TCE is the owner of the customer issues throughout the resolution process. Create Methods of Procedure (MOP) and action plans for post-sales projects. Utilize the Cisco technical service lab to recreate and resolve customer issues. Develop expertise in specific areas (i.e. technology, product). Manage the issues/customers by setting expectations and meeting/exceeding those expectations to achieve the highest level of customer satisfaction. Effectively communicate/escalate issues to engineering within Cisco, and deliver resolutions/work-around to the customer. Work with Sales and Professional Services to develop state-of-art customized Wireless LAN solutions for customers worldwide. Bachelor’s degree in Computer Science or related field, Master’s Degree a plus. Must have excellent written and verbal communication skills, as this role requires significant interaction with partners, customers, and internal stakeholders within Cisco. Minimum 3 - 5 years’ experience designing, deploying, configuring, supporting, trouble shooting, debugging, and administering Wireless Networks products, devices, and technologies. Must demonstrates an aptitude and appetite for learning new technologies, evidenced by the ability to expand upon core knowledge. Must have in-depth technical knowledge in the following areas: Cisco AireOS Wireless LAN Controllers, IOS-XE Wireless LAN Controllers, IOS-XE Catalyst Wireless LAN Controllers, and Virtual Wireless LAN Controllers Cisco Wireless Access Points: IOS Access Points Cisco Prime Infrastructure, Wireless Mobility Services: MSE, CMX, DNA Spaces, DNA Center (DNAC), BLE technology, ISE integration, and IoT technology Virtualization technologies (VMware, Openstack, KVM, etc.) Programming skills in Python and Bash scripting System Admin level expertise in Linux and Open Source technologies"
112,Technical Leader - Solutions Engineering,https://jobs.cisco.com/jobs/ProjectDetail/Technical-Leader-Solutions-Engineering/1390251," Experience in 2 or more of the following areas: Encapsulation protocols like MPLS / MPLS-TE, GRE, LISP, EoMPLS, VPLS, MGRE, VXLAN, LDP/mLDP, Bonjour Netflow / Telemetry / Analytics L2 and Routing Protocols (e.g. OSPF, BGP, RIP, ISIS, etc) MACsec, CTS, SGACL, IPSEC, First Hop Security, ACL Policies, Network Data Analytics, Dot1X. Strong programming skills, using Java, Python, or other object-oriented languages. Excellent knowledge in Cloud-based controller and Cloud technologies Hands-on experience with Unix/Linux environments, with knowledge of virtualization. Understanding LAN/WAN protocol like Ethernet, wireless, routing protocols is a big plus. Cisco Networking certificates, such as CCNA, CCNP, etc. are highly desirable. Excellent written and verbal communication, influential, decision-making, leadership, team, and people skills."
113,Technical Consulting Engineer 1390202,https://jobs.cisco.com/jobs/ProjectDetail/Technical-Consulting-Engineer-1390202/1390202," Bachelor’s degree and/or 3-6 years equivalent experience in related fields. Excellent written & verbal communication skills and can present/communicate ideas effectively across different audiences, such as Sales, Customers, or Engineering. Excellent time management Leverages software skills and tools to configure, deploy and/or troubleshoot Cisco products and solution  Ability to drive customer satisfaction and take ownership for customer success. Produces and shares intellectual capital (including documentation and training) within technology and adjacent areas for internal audiences, Global Delivery Partners, and customers. Contributes in the development of digital intellectual capital (e.g. scripts, digital signatures). Has advanced knowledge of global customer issues and can think about and recognize impacts at a large scale Can Design, Build and utilize complex lab setups across multiple technologies to duplicate and resolve problems, including use of traffic generators. Recognizes and submits bugs with all required related information. Mentors others to file bugs. Understands all fields within a defect and actively works to improve readability for others. Work with engineering to improve product quality by filing software defects or enhancements and testing fixes Submits effective escalations with Engineering teams. Frequently assists other TCEs and Global Delivery Partners with problem resolution. Mentors and develops more junior TCEs and Global Delivery Partners. Active CCNP (or higher) Enterprise Certification desired  Expert in at least one of the following Layer 2 Protocols with a broad knowledge of those remaining - STP, VTP, LACP, PAGP, IGMP, ARP, VSS, and QoS Expert in at least one of the following Layer 3 Protocols with a broad knowledge of those remaining - OSPF, EIGRP, BGP, PBR, VRF, PIM, MPLS, IWAN and VXLAN Advanced Knowledge of WireShark and is able to analyze traffic flows to properly root cause network and/or application issue  Competent user of Windows/MacOS and Microsoft Office Suite and the most commonly used Cisco tools and procedures. Is an expert in at least one platform architecture, with broad knowledge of other platforms and software architectures they support. Has site level impacts potentially spanning multiple teams. Thinks beyond just problem resolution and leverages automation or other methods to advance outcomes. Effectively collaborates across technology silos to drive customer success and builds cross-technology knowledge."
114,Technical Consulting Engineer- ID 1390200,https://jobs.cisco.com/jobs/ProjectDetail/Technical-Consulting-Engineer-ID-1390200/1390200," Provides second/third level technical support worldwide via phone, email, web, and remote access for IOS-XE and IOS-XR products such as NCS55xx, NCS520, CBR8, NCS5xx, ASR1K, ASR9xxx, ASR9xx. Working knowledge of the Networking industry, products, and protocols. Crisis management skills and ability to handle critical customer issues/problems. Customer Experience Engineers drive projects with the Business Unit and will be part of several engineering and Technical Content Delivery activities. Works on problems of moderate to the broad scope and medium to high complexity where analysis of situations or data requires a review of identifiable factors. 5+ years of support-related experience. 5+ years of IP/Networking, routing protocols, or proven experience. 5+ years of experience working in at least THREE of the following SP-focused technologies: Routing Protocols (OSPF, RIP, EIGRP, BGP, IS-IS), IPv4, IPv6, Multicast, MPLS, Quality of Service, L2VPN, L3VPN, Spanning Tree, DHCP, VLAN and VTP, EtherChannel, VSS, SPAN / RSPAN, DOCSIS. Strong communication skills, both oral and written. BS in a technical field (CS/EE preferred) or equivalent; 5 years of proven experience [MH1]. Experience or Certifications in one or more of the following is preferred: CCNP or higher, preferably CCIE in Collaboration, Data Center, Security, Voice, Wireless, Routing, Switching [MH2], or SP. Troubleshooting experience using Finisar, Wireshark, or other protocol analyzers. Programming skills (Python, Ruby, C, C++, Linux, and Shell Scripting). Routing Protocols, IPv4, IPv6, MPLS, Multicast, Quality of Service, L2VPN, L3VPN, Switching, IOS-XR, IOS-XE, ASR1K, CBR8. Service Provider experience and service support experience are a plus. Data Center, SP-Cable, SP-Video, CCAP, and CMTS experience are plus."
115,Software Engineer,https://jobs.cisco.com/jobs/ProjectDetail/Software-Engineer/1390174," Develop and test new software features in a real-time Linux (or similar) OS environment. Develop and test complex modules of code. Debug and provide solutions for existing deployments. Write functional, design, and test specs. Be closely involved in testing the features and taking them to the deployment stage. Work closely with Product Development teams at other sites. Bachelor of Science or Master of Science in computer science, software engineering or a related field Knowledge of C, C++ or Python Some exposure to Systems and Network programming Proven understanding of Linux development tools (gdb, buildroot, crosstool-ng, etc.). Ability to adapt and learn new and sophisticated development environments with extensive analytical skills Excellent verbal and written communication skills with a willingness and desire to collaborate with other team members and learn new skills in web development Knowledge of PKI, Certificates, AAA, RADIUS Network Security Multi-threading, synchronization, and memory management Performance analysis Automation skills in Python Agile development methodologies"
116,Engineering Project Specialist - ThousandEyes,https://jobs.cisco.com/jobs/ProjectDetail/Engineering-Project-Specialist-ThousandEyes/1390157," Work on special projects with Engineering leaders, organize and support events for the team such as boot camps and brown bag sessions Support key Engineering branding projects and strategies to ensure we grow and scale at an extraordinary pace Coordinate initiatives and projects with HR, Recruiting, and other teams (as needed) to ensure a seamless employee onboarding experience Identify business requirements, and plan project milestones, timelines, and resources. Follow up on any issues and dependencies with key partners Partner with admins and engineers on company-wide initiatives and events Oversee the delivery of the onboarding experience for Engineering new hires Gather feedback from new hires and managers on the experience to identify ongoing improvement opportunities Create and maintain project management data, including project plans, action item lists, and spreadsheets You will work closely with Engineering, Tech Recruiting, and other teams on topics related to the interests of the Engineering org. Team members may vary per project but include the ThousandEyes Engineering leadership team, program management team, and admins. Proactive. You anticipate events so that you are prepared ahead of time and can take control of any situation Collaborative. You take an organization-level view and are equally invested in the success of others. You quickly establish trusting relationships that enable you to influence others and give and receive feedback Creative & flexible. You bring up new ideas and new ways to solve problems and accelerate our business 2+ years of experience as a Project Specialist, Business Admin, or similar positions. Experience with onboarding programs is a plus Knowledge of MS Office and Google Workspace Proficiency in PowerPoint and Google slides Experience supporting Engineering teams is a plus Experience with Engineering branding is a plus


We Are Cisco
#WeAreCisco, where each person is unique, but we bring our talents to work as a team and make a difference powering an inclusive future for all.
We embrace digital, and help our customers implement change in their digital businesses. Some may think we’re “old” (36 years strong) and only about hardware, but we’re also a software company. And a security company. We even invented an intuitive network that adapts, predicts, learns and protects. No other company can do what we do – you can’t put us in a box!
But “Digital Transformation” is an empty buzz phrase without a culture that allows for innovation, creativity, and yes, even failure (if you learn from it.)
Day to day, we focus on the give and take. We give our best, give our egos a break, and give of ourselves (because giving back is built into our DNA.) We take accountability, bold steps, and take difference to heart. Because without diversity of thought and a dedication to equality for all, there is no moving forward.
So, you have colorful hair? Don’t care. Tattoos? Show off your ink. Like polka dots? That’s cool. Pop culture geek? Many of us are. Passion for technology and world changing? Be you, with us!

***This role is onsite in San Francisco, California
 Cisco COVID-19 Vaccination Requirements
The health and safety of Cisco's employees, customers, and partners is a top priority. Our goal is to protect and mitigate the spread of COVID-19 infection for strong business resiliency during the pandemic. Therefore, Cisco may require new hires to be fully vaccinated against COVID-19 if the role requires business-related travel, meeting with customers/partners (including visiting third-party sites on behalf of Cisco), attending trade events, and Cisco office entry, unless otherwise prohibited by applicable law, and in countries where COVID-19 vaccination is legally required. The company will consider legally required accommodations/exceptions for medical, religious, and other reasons as per the requirements of the role and in accordance with applicable law. Additional information will be provided to candidates about the requirements and accommodation process at the offer time based on region."
117,Sr. Software Engineer - Endpoint Health-Duo Security,https://jobs.cisco.com/jobs/ProjectDetail/Sr-Software-Engineer-Endpoint-Health-Duo-Security/1389956," 7+ years of development experience, especially with web application or native desktop applications You love working with Python, Swift, C++, or C# You have a history of writing performant, maintainable, testable code You have mentored several early career engineers You value automated testing as much as writing expressive clean code You strive to make security simple to understand and easy to implement You love automation — particularly CI/CD You have created multiple automated test suites for desktop products  Scalability of both products and processes is a passion of yours Prior experience with automated configuration tools like Ansible, Puppet, Chef, etc Prior experience deploying cloud services, monitoring, alerting, and handling escalations You have worked in at least one agile team (Kanban, scrum, any common established framework). The team delivered at least one multiple quarter project to production. You have experience supporting a high-availability SaaS environment You have knowledge of network security, encryption, authentication, and authorization You have a solid understanding of security best-practices in web development You thrive having the autonomy to operate in a meaningful problem space solving real problems for real people. You work best in teams of high-performers who are passionate about a common goal. You revel in the opportunity to do it all; from desktop to web, to production deployment! You only code alone and aren't willing to mentor and be mentored. You lack a real passion for writing high-quality secure software that is backed by an equally mature approach to testing. You stress under the ambiguity of a problem and default to others to provide you with the answers. Your first instinct is to point out why something can’t be done rather than focusing on what the customer problem is. You tire at the thought of a steady, deliberate pace in both a product and company."
