,job_title,job_link,job_desc
191,Software Development Engineer,https://jobs.cisco.com/jobs/ProjectDetail/Software-Development-Engineer/1394014," Design and code custom software programs, APIs and Micro Services to integrate best-of-breed technologies used by multiple partners in Cisco Legal. Collaborate with architects, developers, security specialists and vendors on innovative solutions to sophisticated business problems, using cloud-based and on-prem technologies. Code, Lead, evaluate and coordinate software development solutions. Conduct code and design reviews and collaborate with solution, cloud and security architects. Connect with product managers, business analysts and end-users daily to deliver technology solutions for their business and operational objectives. Translate designer mock-ups, wire frames and data flows into POCs using UI tools such as HTML5, CSS and AngularJS. Be highly collaborative with product management and technical support where feedback is used for continuous improvement with iterative work. Bachelor’s in Engineering degree in Computer Science, Electronics & Communications, Information Science or equivalent fields Minimum 4 years of experience as Software Engineer with a firm grasp on the newest technology trends in the industry. Experience with agile software development and LEAN/continuous delivery methodologies In-depth programming knowledge in all or some of the following: Programming Languages: Java (J2SE & J2EE), Python, Servlets, JSP, JSTL, EJB, JDBC, JMS, JNDI, JAXB, JAX-WS, JAX-RPC, Spring/Struts/Hibernate, ElasticSearch Web Technologies: MEAN Stack, Angular JS, NodeJS, AJAX, JQuery, XSLT, JavaScript, HTML, DHTML and CSS. Database: Oracle, SQL Server, DB2, MySQL, No SQL (Mongo DB) App / Web Servers: IBM WebSphere 7/6/5, Tomcat 6/5, WebLogic, JBoss MEAN stack experience is required (MongoDB, Express, Angular, Node.js) Hands on experience with SQL Server is highly desired Experience with Salesforce and MuleSoft integrations is preferred Experience with message queue design patterns Create build / package scripts for deploying applications using GitHub, Jenkins, Artifactory, Ansible and similar tools Experience designing, developing, securing and managing APIs via API Gateways and proxies Experience architecting & developing highly scalable, cloud-native, decoupled, fault-tolerant & highly available microservice architectures hosted on-prem, in the cloud and/or in a hybrid cloud environment Excellent decision-making and analytical skills to solve complex business problems Ability to work in a diverse, fast-paced environment and effectively collaborate across global teams Experience in automated testing (unit/integration) Experience with SaaS data integration Organized verbal and written business communication that effectively achieves business objectives Strong customer focus and can-do attitude with an eye for process simplification and digitization Apply specific business knowledge and general discernment to support effective IT engagement Experience in engaging with focused POC’s and Prototypes for Enterprise IT environments that have Global footprint Write and review code, develop documentation and capacity plans, and debug the hardest problems on the largest and most complex systems Develop software solutions by studying information needs; conferring with users; studying systems flow, data usage, and work processes; investigating problem areas; following the software development lifecycle. Experience in Legal technology domain (Contract Lifecycle, Approvals, eSignature, Invoice Management, eDiscovery) is desired"
192,Sr Financial Analyst,https://jobs.cisco.com/jobs/ProjectDetail/Sr-Financial-Analyst/1392059," Drive Opex consolidation for your group, and work with the team on updating Forecasts in alignment with corporate timelines. Provide bridges, and explain variances vs Forecast Lead key portions of Security budget - involved in all aspects of forecasting and planning and collaborating with key business partners driving business goals and initiatives. Responsible for overall SBG opex and HC reporting and forecasting process, improving forecast accuracy and understanding forecast drivers. Proactively identify, develop and implement enhancements to existing reporting and business processes Refine and develop monthly and quarterly operations/finance reviews. Responsible for reporting key financial information for effective decision-making. Lead monthly forecast review calls with Finance and Ops; provide an opportunity to present to Senior leadership and get good visibility. Ad-hoc analysis relating to the operational efficiency operations team, Finance leaders, and SBG finance FP&A. Bachelor’s degree in Finance / Accounting / Business with 2-4 years of related work experience Strong analytical skills & attention to detail, with the ability to calibrate communications to the level of detail appropriate to the situation and audience Self Starter who regularly takes initiative and can balance multiple projects simultaneously, demonstrating creativity and judgment while prioritizing appropriately to meet tight deadlines A proven ability to problem-solve and proactively address issues in a professional and effective manner Advanced Excel and PowerPoint Knowledge of Hyperion Essbase, Business Objects a plus"
193,Java/Python Software Engineer,https://jobs.cisco.com/jobs/ProjectDetail/Java-Python-Software-Engineer/1394027," Work with various cross-functional groups such as product management, other development teams, QA, and documentation Architect, design, test and delivery system software to satisfy automation requirements Participate in technical discussions and provide innovation to the automation effort Minimum of 7 years experience in software design, and application development 2-5 years of experience developing applications based on microservice architecture and API development Strong background in Software Design and Architecture and complete Agile development life cycle Requires hands on experience with crafting a microservice based architecture, container deployments and management tools like Kubernetes, docker, etc. Experience developing in a CI/CD, Devops model with full knowledge of Jenkins, GIT, is required Hands on development experience with Java and Python. Hands on experience in Golang is highly desirable. Experience in any one of the public clouds like AWS, Azure & GCP is highly desirable. Experience with various persistence technologies like Cassandra, MongoDB, ElasticSearch, as well as MYSQL is highly desirable. Possess strong ability to solve sophisticated problems creatively Must be a team player with the ability to work well in both small and large groups"
194,Senior Analyst - Financial Controls & Compliance,https://jobs.cisco.com/jobs/ProjectDetail/Senior-Analyst-Financial-Controls-Compliance/1392805," Maintain knowledge of current accounting and auditing practices and regulations Detail all work and maintain changes/updates in the SOX System of Record (BWise) Partner cross-functionally with business and IT process and control owners to drive remediation actions for timely closure of control deficiencies  Prepare and report out metrics for functional processes to PMO Management, CFO Staff, and cross-functionally to Process Team Leads and/or Business Process Compliance Owners  Drive internal control risk assessment and readiness of business process, system or organizational changes being driven by significant corporate initiatives/projects and/or information technology implementations.  Effectively communicate with and educate functional process owners, including non-finance individuals, on financial reporting risks, the importance of controls, an effective control environment and the role of the SOX audit team.  Provide oversight and mentorship to SOX specialists in the quarterly test of internal controls and review test results  Being responsible for the annual evaluation of SOX prioritizing and end-to-end process and internal control design through walkthroughs with key partners - SOX IT, External Auditors, and the functional business process owners Strong understanding of financial reporting risks and appropriate control design Strong accounting and analytical skills with confirmed ability to apply knowledge Excellent organization skills with attention to detail Self-starter and ability to drive action items to closure Ability to work with cross-functional teams Ability to communicate effectively with strong interpersonal skills Big 4 Audit Experience Preferred 3+ years of audit/accounting / control design or related experience Bachelor’s Degree in Accounting or related finance degree, with MBA/CPA, preferred"
195,CPX Sr Financial Analyst,https://jobs.cisco.com/jobs/ProjectDetail/CPX-Sr-Financial-Analyst/1392786," Support case development for funding requests Work closely with functional leaders and business operations to rationalize budgets Maintain projection models to support the annual budgeting cycle Prepare and facilitate monthly forecasting Ensure activities are accurately forecasted, and forecasted activities are accurately driven Recommend risk/opportunity adjustments with an objective point of view Maintain headcount forecast modeling with a high degree of precision Prepare and distribute spend reports; validate transactional expenditures Build and maintain analyses, trends, and metrics to influence/drive spending efficiency Perform cost estimation to assess affordability for resource acquisition Facilitate transactional execution including partner agreement, compliance check, and system processing Advise the business on transactional accounting treatments and impact on the forecast Be an ambassador of Cisco’s financial policies – educate the business, implement the policies, coordinate audits and remedial actions Track QTD actuals and to-go activities to assess risks/opportunities in the forecast Coordinate timely and accurate PO accruals and closures Partner with Accounting on capitalized costs, amortization, and payroll entries Reconcile general ledgers against forecasted spending; identify and resolve gaps Maintain alignment of departmental and P&L hierarchies Identify, recommend and facility operational improvement Provide support in special projects (Zero Based Budgeting, Agile Forecasting, Comp Strategy, Cost Classification) BS degree in Finance, Accounting or Economics (MBA and/or certification a plus) 4+ years of validated experience with a background in finance and accounting Strong command of complex data modeling using Microsoft Excel, such as the utilization of pivot tables, vlookup, hlookup, sumif, sumifs, countif, if/and/or Ability to lead live Webex meetings and perform on-the-spot data analysis Capability to transform large data sets into digestible summaries Succinct communication; ability to connect the dots from the numbers to the business Familiarity with finance tools (Business Object, Hyperion/Essbase, FinABC)"
196,"Leader, Technical Systems Engineering 1390951",https://jobs.cisco.com/jobs/ProjectDetail/Leader-Technical-Systems-Engineering-1390951/1390951," A sharp problem solver who sees deeply into business challenges and has an uncanny sense of how to meet them Subject matter expert in global IT processes, services and policies, and ability to apply this knowledge to developing new techniques and standards within the organization Identify process improvement opportunities from testing and prepare recommendations; assist in assessing the impact of the gap on business and finance processes. Effectively communicate to all levels of management. Track, monitor, and validate that any observations have been effectively remediated. Understand the various company policies and apply them to the analytics and investigations. Coaching and managing junior members of the team. Advise and consult with Process Owners on identifying risks and controls & identifying root causes Bachelors plus 8 years of related experience Experience using Microsoft Office 365 applications, Jira Cloud and Jira Align. Strong Experience in agile delivery model Must be hands-on, with ""roll up your sleeves"" attitude to drive program success. Ability to multi-task, organize & lead a group of architects, engineers, analysts while attending to all details Organized verbal and written business communication that effectively achieves business objectives Ability to drive continuous improvements and operational excellence Collaborative and open style with a constructive and positive attitude Strong communication, interpersonal and mentoring skills & Ability to adapt to a changing environment"
197,"Tax Manager, IMI Mobile",https://jobs.cisco.com/jobs/ProjectDetail/Tax-Manager-IMI-Mobile/1390405," Preparing the sales & use tax compliance Complete account reconciliations Provide reports to 3rd party for certain VAT/GST returns and review and approve Provide tax guidance to tax staff and operations Conduct sales and use tax audits Partner with accounts payable, accounts receivable, accounting, legal, and other internal groups Perform technical tax research Perform special projects BS/BA in Accounting, Finance or Business Administration 5-7 years multi-state sales and use tax experience Experience with VAT and GST preferred, but not required Proficient in Oracle, Sabrix (OneSource), Excel, Word, and PowerPoint."
198,Finance Manager - CX Acquisition Integration,https://jobs.cisco.com/jobs/ProjectDetail/Finance-Manager-CX-Acquisition-Integration/1389909," Maximize shareholder value through fiscal responsibility and disciplined investment Represent CX Finance to all other integration teams and provide finance expertise to facilitate the integration of acquired companies. Draw from experience to provide finance leadership for each acquisition. Work in partnership with the Corporate Business Development team in providing unique CX insight when required, to complete business cases for target acquisitions, as part of the CFO pre-commit and commit. Actively look for opportunities to improve the CX integration process and collaborate with business leaders, functions, and cross-functional teams to drive improvements in the integration process for CX. Provide guidance in converting acquired offers to Cisco offers collaborating with CX Product Managers, CXPM Finance, and Corporate Revenue (influencing pricing, profitability, attribution and revenue recognition, and COGS alignment). Collaborate with cross-functional teams to define processes and policies as needed to move CX integration forward. Partner with Center of Excellence and WW FP&A team on acquisition reporting and data quality transformation Provide periodic status reports to relevant parties and drive all CX finance acquisition integration activities. Support ad hoc projects, analysis, and reporting Bachelor's degree (or equivalent) in finance, business administration, or related field 6-8 years relevant working experience MBA or CPA preferred Excellent communication and interpersonal skills Experience working cross-functionally"
199,Controls & Compliance Lead,https://jobs.cisco.com/jobs/ProjectDetail/Controls-Compliance-Lead/1388886," Partner with cross-functional teams and consultants on process reviews, ensuring quality of RACMs, flowcharts, observations. Partner with functional teams on on-going control monitoring and maintenance activities such as documentation updates, testing results, and other process changes Consult on ad-hoc control review projects, providing guidance to teams on how to assess process, risks, and controls. Effectively communicate with and educate process and control owners on risks, controls, and the role of the FSS Compliance Team Prepare and report out metrics for projects to management, cross-functional teams, and Executive Management Maintain knowledge of current accounting and auditing practices and regulations Bachelor’s Degree in Accounting or related finance degree, with MBA/CPA preferred Strong interpersonal and communication skills with the ability to work with cross functional teams Self-starter with ability to drive action items to closure Excellent organization skills with attention to detail Strong accounting and analytical skills with proven ability to apply knowledge Strong understanding of financial reporting risks, operational risks and appropriate control design CPA, CIA, CISA certification External and/or internal audit experience / SOX experience Strong knowledge of shared service processes (Payroll, Invoice to Cash, Accounts Payables)"
200,Senior Inventory Financial Analyst,https://jobs.cisco.com/jobs/ProjectDetail/Senior-Inventory-Financial-Analyst/1386792," Work with the Accounting Manager on day-to-day accounting activities related to inventory utilizing the Oracle C3 platform, UI Path bots, and other systems Manage aspects of the month-end close process and reconciliations Support CCG GAR accounting teams with queries and analysis on issues impacting their entities Assist with research and analysis on IT issues. This will include isolating and identifying root causes, determining impacts and suggesting corrective actions Support the team's ongoing Country Enablement projects and other cross-functional activities where we are stakeholders and/or have deliverables"
201,Technical Product Owner- SAP BRIM Functional Analyst-1391896,https://jobs.cisco.com/jobs/ProjectDetail/Technical-Product-Owner-SAP-BRIM-Functional-Analyst-1391896/1391896," Working with external partners to define overall program requirements within the product scope, budget, and timelines Documents capability level requirements and their priorities Determine, document and articulate solution feasibility for short-term and long terms Build Business process model design - As-Is vs To-Be process design for capabilities and offers Align with business architecture business rules, policies, key business decisions, cross-program dependencies, and high level solution designs. Align with IT on delivery commit and agile commit. Manage the product backlog (i.e., prioritized list of user stories). Producing accurate and timely reporting of program status throughout its life cycle. In-depth understanding and experience of working in at least X end to end order to cash implementation with focus on SAP BRIM - SOM and CC. Configuration and customization experience in following areas of SAP SOM and CC: 7+ years of related enabling capability for business transformation, Information Technology program management, Service delivery management and/or Portfolio management Confirmed experience with enablement motions with a background in software subscription, services delivery and/or product management Proven ability to negotiate and influence actions of team members outside of function for improved team and service performance Experience with Agile development methodology Well-developed teamwork, collaboration and project management skills Advanced leadership skills including leading by influence"
202,Software Engineer-1389998,https://jobs.cisco.com/jobs/ProjectDetail/Software-Engineer-1389998/1389998," Build and Deployment of ABAP Program Performed code configurations Managed transport requests Creation analysis and design documents which includes tables, relations, screens Participated in code and design reviews Coordinated with multiple vendors from geographically distributed teams You will work with partners across the Operations, with focus on Subscription Management space to implement business capabilities. Work with multi-functional leaders and SMEs, including those of BUs, Sales, Customer Success, Finance etc. to drive alignment and execution. Work with the business analysts, product owners and IT delivery teams to drive vital system capabilities changes. Candidate should able to debug if deep analysis required hence technical knowledge is required. Experienced in OData Development/Troubleshoot Expert knowledge in ABAP on HANA 10+ years of related enabling capability for business transformation, Information Technology program management, Service delivery management and/or Portfolio management You have high-level program ownership, are good at conflict resolution, critical thinking, can handle unknown situations, good judgment, high productivity and ability to multi-task. Confirmed experience with enablement motions with a background in software subscription, services delivery and/or product management Demonstrated ability to negotiate and influence actions of team members outside of function for improved team and service performance Hands-on implementation experience of SOM, CC (Convergent Charging), with at least 2 complete lifecycle implementation experience. Experience with Agile development methodology Well-developed teamwork, collaboration and project management skills. Advanced leadership skills including leading by influence ABAP Certified professional Implementation and Support experience in SAP CRM. Experience in multiple end to end implementation and roll out projects. Exposure to Integration of SAP CRM and CC, ECC Solid understanding of ABAP DDIC and ABAp Programming. Strong experience with Development Tool Kit using HANA studio or Eclipse. BRIM Knowledge is helpful"
203,Backend Software Engineer-1390776,https://jobs.cisco.com/jobs/ProjectDetail/Backend-Software-Engineer-1390776/1390776," Applying principles and techniques of engineering, mathematics, and computer science to the design, development, and testing of business software applications. Will work as a member of a scrum team (Agile/SAFe) across the entire software development lifecycle. Demonstrating general purpose programming languages and development technologies always with a security demeanor. This is a dynamic role that may provide the opportunity to work in any part of the development stack. Developing software and tools in support of application design including utilities, database technologies (relational, NOSQL, and Big data), cloud-based and Internet-related tools. Applying full stack App/API development, Unix/Linux environments, distributed and parallel systems, information retrieval, networking, cloud provider services, and/or container technologies. Scaling systems sustainably through mechanisms like automation, and evolve systems to improve reliability, supportability and velocity (SRE). Building commitment, scalable, low latency services using the latest technologies and handles information at extensive scale. Evaluating and demonstrating new technologies in the product architecture, including AI. You are passionate about building cloud native platforms. You have a track record of delivering high quality software, with predictability using software prioritization and prioritization techniques. You have experience shipping features in an agile development environment using either Scrum and/or Kanban. You have good interpersonal skills (written and verbal) You enjoy doing code reviews and providing technical mentorship. You have experience with Linux, containers, and Kubernetes. You have a BS in Computer Science or other technical subject area You are able to build relationships, be culturally sensitive, have goal alignment, have learning agility. You have 10+ years of experience in working IT You have 5+ years of experience in Design & implement performance and high availability platforms that can support P1 applications. You have 5+ years of hands on experience in open source technologies like ELK stack, TIG stack, Graylog, Kafka, Mongo, Spark, etc. You have 5+ years of experience in Java, Python, Spring Frameworks, REST API’s, Streaming, databases, etc. You have 3+ years of working experience cloud technologies (Openstack, Openshift, AWS, etc.) Good understanding of supervising tools App Dynamics, Science Logic, ThousandEyes, Oracle Enterprise Manager, Core Infra tools, etc. Good understanding of Service Management portfolio(ITSM, ITOM, CMDB) and integrating with them. Extensive knowledge of the software development process (SAFe) Exposure with CI/CD tools and continuous integration – Jenkins, SonarQube, Git."
