,job_title,job_link,job_desc
268,Technical Sales Engineer (Intern) United States,https://jobs.cisco.com/jobs/ProjectDetail/Technical-Sales-Engineer-Intern-United-States/1382150," Work with Sales Engineering to diagnose and resolve critical issues Research customer challenges alongside your team Participate in stretch projects in a team and individually Learn about potential career paths beyond your internship Including but not limited to an upcoming graduate of a technical degree or certification program from a Technical Boot Camp, Apprenticeship, Community College or 4-Year University. Pursuing a BS or MS degree in Computer Science, Computer Engineering, Data Science, Mathematics, Physics, or other equivalent degree in a technical discipline is required Excellent written and verbal communication skills You have a real passion for technology You are a creative thinker and problem solver Strong skills: Researching, influencing, organization, adaptability, flexibility, and highly self-motivated Proven leadership, interpersonal skills, and ability to work in a collaborative environment - all with a positive attitude Fluent in English (written and verbal), as well as fluent in local language for country of application and must be able to legally live and work in the country for which you're applying, without visa support or sponsorship. (student visas or visas obtained on your own are not applicable for the program.)"
269,Field Sales (Intern) United States,https://jobs.cisco.com/jobs/ProjectDetail/Field-Sales-Intern-United-States/1381681," Work with our Sales team to gain exposure into customer engagement and the selling cycle Research customer challenges alongside your team Opportunities for shadowing, mentoring and coaching Participate in stretch projects in a team and individually Learn about potential career paths beyond your internship Including but not limited to an upcoming graduate of a certification program from a Boot Camp, Apprenticeship, Community College or 4-Year University Excellent written and verbal communication skills. You are a creative thinker and problem solver Proven leadership, interpersonal skills, and ability to work in a collaborative environment - all with a positive attitude You can legally live and work in the country for which you’re applying, without visa support or sponsorship."
270,FLEX Rising Leaders (Full Time) United States,https://jobs.cisco.com/jobs/ProjectDetail/FLEX-Rising-Leaders-Full-Time-United-States/1380414," Our People & Communities (HR) organization: home to our traditional People & Communities functions like HR Business Partners, Compensation, Workforce Planning and Analytics, Talent Acquisition, Learning & Development, Mergers & Acquisitions, Employee Relations, DEI (Diversity, Equity, and Inclusion) (diversity, equity, and inclusion) (diversity, equity, and inclusion), amongst others. Our Policy Organization: home to our Government Affairs organization which manages how Cisco interacts and collaborates with local, national, and international governments. Our Purpose Organization: home to our teams responsible for driving Cisco’s work to build a more inclusive future for all such as Strategy and Planning, Country Digital Acceleration, Environmental, Social, and Governance (ESG), Corporate Affairs, and Workplace Resources and Real Estate, amongst others. Work on projects that will increase value to the business Drive several team-based projects and complete individual stretch assignments Collaborate with senior leadership, managers, cross-functional teams, and other members of the FLEX community Contribute to the FLEX Community by participating in program-specific key elements Participate in professional development workshops, function-specific training, and business seminars often led by industry leaders Graduating from an MBA or a Master's degree before August 2023 You have four plus years of related work experience between Bachelor's and Master's programs or during Master's program Show excellent academic credentials with comprehension of business fundamentals including finance, marketing, operations, and strategy You have shown leadership skills and an ability to motivate change Demonstrate the ability to think strategically, partner with business units, and articulate how HR can positively impact business effectiveness (no prior Human Resources experience required) You have a passion for building a career in Human Resources or purpose-driven work. While 3P is home to our HR function, anyone with a passion for purpose-driven work can find success with FLEX. You can provide a current resume at the time of application. Cover letters are optional. Feel free to submit a cover letter if there is something you would like us to know or expand on. Able to legally live and work in the country for which you are applying, without visa support or sponsorship"
271,Component Engineer- Memory,https://jobs.cisco.com/jobs/ProjectDetail/Component-Engineer-Memory/1377715," Assessment and qualification of new memory devices and processes. Partner with Cisco development engineers, commodity teams, and suppliers/partners to develop next-gen memory components to meet Cisco requirements Partner with Advanced Silicon & Package Technology groups for assessment and qualification of new technologies Define, maintain, and drive memory component qualifications. Partner to develop memory commodity strategy, supplier selection, and perform supplier technical audits PCN process: Cisco Approved Vendor List (AVL) maintenance and change management, including technical evaluation of changes Point of escalation to drive component failure analysis, containments, and root cause corrective actions - Collaborate with development/manufacturing engineering and management representatives to resolve sophisticated technical problems. Knowledge of semiconductor components and modules: design, fabrication, characterization, qualification, testing, quality, reliability, failure analysis Good fundamentals in Device Physics, Circuit Design and Logic Design Fundamental knowledge of Flash and DRAM memory devices and logic devices used on these products: Understand Device specs (timing, power, bandwidth, latency), usage models in networking and server, signal integrity issues, mechanical and packaging challenges, etc Extensive knowledge of solid state drives, SATA and NVMe (PCIe) as well as embedded flash drives, eMMC, UFS etc. Familiarity with Semiconductor Suppliers: Roadmaps, qualifications, process changes, industry and market drivers, etc Able to perform design of experiment, root cause analysis and resolve problems on a conceptual and advanced troubleshooting level Familiarity with Quality Management Systems, ERP tools, FMEA methodology, statistical analysis, etc Strong partnership & collaboration skills. Excellent problem solving & effective conflict resolution skills. Effective multi-functional communication, presentation and social skills Collaborate with internal and external executives via executive summaries and project status overviews Typically requires MSEE or equivalent."
272,FLEX Rising Leaders (Intern) United States,https://jobs.cisco.com/jobs/ProjectDetail/FLEX-Rising-Leaders-Intern-United-States/1372481," Our People & Communities (HR) organization: home to our traditional People & Communities functions like HR Business Partners, Compensation, Workforce Planning and Analytics, Talent Acquisition, Learning & Development, Mergers & Acquisitions, Employee Relations, DEI (diversity, equity, and inclusion), amongst others. Our Policy Organization: home to our Government Affairs organization which manages how Cisco interacts and collaborates with local, national, and international governments. Our Purpose Organization: home to our teams responsible for driving Cisco’s work to build a more inclusive future for all such as Strategy and Planning, Country Digital Acceleration, Environmental, Social, and Governance (ESG) , Corporate Affairs, and Workplace Resources and Real Estate, amongst others. Work on projects that will increase value to the business Drive several team-based projects and complete individual stretch assignments Collaborate with senior leadership, managers, cross-functional teams, and other members of the FLEX community Present analysis and recommendations on a pivotal initiative to the 3P leadership team Participate in professional development workshops, function-specific training, and business seminars often led by industry leaders Currently enrolled in an MBA or a Master's degree You have four plus years of related work experience between Bachelor's and Master's programs or during Master's program Show excellent academic credentials with comprehension of business fundamentals including finance, marketing, operations, and strategy You have shown leadership skills and an ability to motivate change Demonstrate the ability to think strategically, partner with business units, and articulate how HR can positively impact business effectiveness (no prior Human Resources experience required) You have a passion for building a career in Human Resources or purpose-driven work. While 3P is home to our HR function, anyone with a passion for purpose-driven work can find success with FLEX. You can provide a current r esume at the time of application. Cover letters are optional. Feel free to submit a cover letter if there is something you would like us to know or expand on. Able to legally live and work in the country for which you are applying, without visa support or sponsorship"
273,"Product Marketing Manager, Video Surveillance - REMOTE (Meraki)",https://jobs.cisco.com/jobs/ProjectDetail/Product-Marketing-Manager-Video-Surveillance-REMOTE-Meraki/1392838," Serve as an expert in all things related to MV – our innovative cloud-based camera solution that simplifies video surveillance and provides valuable business insights Collaborate across marketing, product, and sales teams to develop a comprehensive positioning and messaging strategy Partner with industry experts to craft compelling vertical messages connecting specific customer needs to camera solutions Stay on top of the competitive landscape to equip our sales and partner teams with competitive intelligence Craft written content such as blogs, sales guides, and thought leadership pieces Lead high-impact product launches that connect our technology to customer needs Serve as the trusted technical and marketing advisor for physical security and other environments, authoring content and supporting broad go-to-market, demand generation, and sales activities Evangelize the Cisco Meraki vision at industry events A passion for the relentless pursuit of better customer experiences Imagination, creativity, adaptability, and critical thinking across products and industries Expertise collaborating across organizations, connecting sales, product, engineering, customers and partners A curiosity about translating technical concepts to all types of audiences; helping customers connect problems to positive outcomes Experience marketing to both large and small organizations, across industries and geographies Experience working in IT, networking, or physical security industries Love of new and emerging technologies Experience with novel applications for connected cameras and IoT devices in enterprises large and small "
274,Payroll Accountant,https://jobs.cisco.com/jobs/ProjectDetail/Payroll-Accountant/1390523," General computer knowledge with the ability to learn/navigate complex tools and processes Ability to dive in and research complex clearing and tax accounts and collaborate with the payroll and accounting teams to ensure timely clearance of all transactions. Work with functional teams to understand issues encountered during reconciliation and determine if process change is necessary Work with business partners to affect change as required Apply reports to monitor clearing accounts to ensure cleared accurately and timely Assist with new business requirements and system testing Assist with completing process documentation as necessary to ensure consistent execution of day-to-day activities for employees and new hires, along with the development of trainings. Capability to act as a liaison between multiple departments Flexibility/willingness to work on special projects as assigned. Strong problem solving and decision-making skills Attention to detail and accuracy is imperative Ability to work effectively as part of a team You hold a Bachelor’s degree in Accounting or Finance, or equivalent experience with end to end payroll experience within a large company. 5+ years of relevant experience is ideal. You have strong operational accounting and reconciliation skills with proven ability to apply. the ability to communicate effectively with strong interpersonal skills and work with cross-functional teams. Excellent Excel skill and proficiency in MS Office suite"
275,Site Reliability Engineer (SRE) | TD&R,https://jobs.cisco.com/jobs/ProjectDetail/Site-Reliability-Engineer-SRE-TD-R/1391233," To secure Cisco customers and keep them protected from threats. Solving cloud infrastructure challenges through software engineering approaches using innovative technologies. Architecting and maintaining secure, highly resilient, and highly available cloud infrastructures to host SPR services. Designing release pipelines that meet the desired velocity for feature releases. In-depth expertise in the administration of enterprise-grade AWS and Azure infrastructures Expertise in triaging, troubleshooting, and addressing production problems in every layer of the stack Experience in capacity and business continuity planning  Background in infrastructure-as-code tools like Terraform Strong security, networking, and Linux systems administration skills Strong scripting skills in Golang, Python and bash Ability to participate in a 24/7/365 on-call rotation Experience in monitoring and analyzing infrastructure using tools such as DataDog and CloudWatch Experience or familiarity with HashiCorp tools like Vault and Packer  Experience with CI\CD tools like Jenkins"
276,Site Reliability Engineer (SRE) | TD&R - Remote,https://jobs.cisco.com/jobs/ProjectDetail/Site-Reliability-Engineer-SRE-TD-R-Remote/1392071," 3-8 years experience in the administration of enterprise-grade AWS infrastructures 1-3 years of Terraform experience Have a background in configuration-as-code tools like Chef Strong Linux systems administration skills Proficient at working at the linux command line Proficiency in infrastructure, service and application monitoring tools Ability to participate in a 24/7/365 on-call rotation Experience with FedRamp, SOC2, ISO, or similar government compliance requirements/processes and security best practices Experience in Golang and Hashicorp tools (Vault/Packer) Familiarity with DataStores and Pipelines, such as Cassandra, Mongo, Kafka and MSK Experience in highly available and critical environments"
277,Senior Front End Software Engineer (React) | TD&R - Remote (U.S. only),https://jobs.cisco.com/jobs/ProjectDetail/Senior-Front-End-Software-Engineer-React-TD-R-Remote-U-S-only/1387943," Proven experience developing web application frontends Building advanced single-page applications (SPAs) using React, Redux, Next.js, and Node Ensuring code quality with Jest, ES2020, and ESLint Emphasizing user experience, cross-browser compatibility, and responsiveness with SASS and Figma Continuous Integration and Git workflows Breaking down complex features into deliverable tasks Familiarity with secure coding practices and standards Understanding of CS fundamentals and patterns Strong communication, interpersonal, and organizational skills BS in Engineering, Computer Science, or equivalent work experience Deploying multi-region AWS instances with Fargate and ECR Configuring cloud infrastructure with Terraform Containerization using Docker"
278,"Product Designer, Cisco IT Design 1386662",https://jobs.cisco.com/jobs/ProjectDetail/Product-Designer-Cisco-IT-Design-1386662/1386662," Collaborate with design, engineering, research, and product partners Clearly and optimally present work to both client and internal teams Build usable designs, concepts, and prototypes Validate concepts with end user and drafts improvements Collaborate multi-functionally to identify user problems and recommend methods to gain customer insights Facilitate requirements sessions with engineers to capture design specifications Apply user-centered methodologies and research in product design Deliver and defend customer-centered design presentations to internal users and team members A remote, multi-functional team of Visual Designers, Product Designers, UX Engineers and specialists Development Managers, Product Managers and additional partners who will craft product requirements Bachelor’s degree in Interaction Design, Graphic Design or equivalent design-related field 5+ years experience is required as a visual, UI or UX designer working with product teams with a portfolio to share Well-rounded understanding of user-centered design process, with a solid foundational knowledge of visual design principles A portfolio of past design work experience, deliverables, and entrepreneurial innovation An independent, fast worker; somebody who doesn’t let ambiguity slow them down Advanced experience working with Figma Strong technical understanding of Design Systems, patterns, and components Strong written and verbal skills"
279,ThousandEyes - Product Sales Specialist (North East),https://jobs.cisco.com/jobs/ProjectDetail/ThousandEyes-Product-Sales-Specialist-North-East/1394528," Identify and source sales opportunities that align with the ideal customer profile for ThousandEyes for the purposes of maximizing solution value and product adoption.  Initiate contact and professional follow-up for all sales meetings within the assigned territory.   Meet all sales objectives and bookings targets in accordance with company growth expectations and develop revenue expansion opportunities across a base of enterprise accounts.  Work side by side with Cisco Account Managers and other Cisco sales specialist to help drive ThousandEyes revenue growth.  Work closely and collaboratively with Customer Success to drive product adoption and usage, as well as with Product Management to understand future requirements to accelerate demand for ThousandEyes in the market.  Highly organized with a results-oriented attitude; adept and detailed in delivering sales presentations, onsite visits and product demonstrations to prospective clients.  Foster mutually beneficial relationships with ThousandEyes customers and partners in a consistent, effective and professional manner.  Meet or exceed quarterly / yearly bookings targets, while delivering consistent and reliable forecasting  Develop and execute a comprehensive account strategy   Accelerate new customer acquisition and upsell growth in existing accounts, while maintaining an accurate sales pipeline  Work closely with customers and channel partners to drive market adoption of ThousandEyes solutions  Lead pricing discussions and contract negotiations  Develop long-term strategic relationships with enterprise customers  Responsible for complete and accurate ongoing maintenance of accounts, forecasts, proposals, and account activity in Salesforce.com  Relentlessly ensure customer success  Minimum 5 years of sales territory management experience working for a technology vendor selling enterprise software to network buyers. SaaS sales experience a plus  A proven track record of consistently exceeding quota selling to large Enterprise / Fortune 500 accounts  Self-motivated, able to solve problems and work with limited direction  Demonstrate Leadership skills  Excellent verbal and written communications skills  Must be comfortable working in a high growth environment, where everyone must have the “roll up your sleeves” and get it done attitude  BS/BA degree preferred "
280,"Security Research Engineer, Remote US",https://jobs.cisco.com/jobs/ProjectDetail/Security-Research-Engineer-Remote-US/1387641," Research security threats, attacker techniques and tools, 0-day vulnerabilities  Create advanced signatures and detection content for Snort, ClamAV, AMP, and other Cisco products  Write in-depth technical advisories about threats and signatures  Analyze malware samples and vulnerable binaries using static/dynamic analysis, debuggers  Create testbed environments to research and run exploits  Conduct short and medium-term in-depth research on novel threats  Develop tooling that forwards the mission of the team  Provide mentorship and training to new team members In-depth experience analyzing, identifying, and exploiting a wide variety of vulnerability types, such as buffer overflows, integer overflows, cross-site and server-side request forgery attacks, insecure deserializations, and authentication bypasses  Extensive knowledge in network traffic analysis using tools such as Wireshark  Advanced knowledge of network, transport, and application layer protocols, such as IP, TCP, LDAP, TLS, RDP, SMB  Proficiency with a compiled language (e.g. C, C++, Rust, Go) and a scripting language (e.g. Python, Ruby, Perl)  Expertise with reverse engineering, malware analysis, and relevant tools (e.g. IDA Pro, Binary Ninja, Ghidra, radare2, x64dbg, WinDbg, OllyDbg)  Expertise analyzing assembly code and identifying code patterns in disassembled binaries  Expert knowledge of memory layout and different segments of a running process, such as the stack and the heap  In-depth knowledge of Windows and Linux internals  Proficiency building and configuring applications and servers in virtual environments for the purposes of reproducing vulnerabilities and testing exploit proof of concepts  Familiarity with asymmetric ciphers (ECC, Diffie-Hellman, etc), symmetric ciphers (AES, DES, etc), and hashing algorithms (MD5, SHA256, etc)  Solid technical writing skills  Ability to work independently with minimum supervision and in a small team, taking on additional tasks as required   Experience with mentorship and the creation and delivery of technical training  7 years of work experience in the security industry  Bachelor’s degree in Computer Science, Cyber Security, or other tech-related degree  Or Masters and 4 years related experience.  Experience with Snort rules language  Background in intrusion detection or forensic analysis  Involvement in the info sec community such as volunteering or speaking at conferences  Experience conducting, documenting, and presenting independent research  Master’s degree in Computer Science, Cyber Security, or other tech-related degree and 4 years of security industry experience"
281,Security Research Engineer,https://jobs.cisco.com/jobs/ProjectDetail/Security-Research-Engineer/1387600," Research security threats, attacker techniques and tools, 0-day vulnerabilities  Create advanced signatures and detection content for Snort, ClamAV, AMP, and other Cisco products  Write in-depth technical advisories about threats and signatures  Capture network traffic from threats for testing IPS and IDS security effectiveness  Analyze malware samples and vulnerable binaries using static/dynamic analysis, debuggers  In-depth experience with vulnerability analysis and common methods of exploiting vulnerabilities, such as Buffer Overflows, Cross-Site Request Forgery, Use-After-Free, XXE  Extensive knowledge in network traffic analysis using tools such as Wireshark  Solid knowledge of network, transport, and application layer protocols, such as IP, TCP, LDAP, TLS, RDP, SMB  Experience with a compiled language (e.g. C, C++, Rust, Go) and a scripting language (e.g. Python, Ruby, Perl)  Experience with the structure of common file formats, such as PDF, MS Office, EXE, ELF  Experience with reverse engineering, malware analysis, and relevant tools (e.g. IDA Pro, Binary Ninja, Ghidra, radare2, x64dbg, WinDbg, OllyDbg)  Experience analyzing assembly code and identifying code patterns in disassembled binaries  Familiarity with the memory layout and different segments of a running process, such as the stack and the heap  Basic knowledge of Windows and Linux internals  Solid technical writing skills  Ability to work independently with minimum supervision and in a small team, taking on additional tasks as required  5 years of work experience in the security industry  Typically, Bachelors + 5 years related experience or Masters + 3 years related experience or equivalent experience.     Familiarity with asymmetric ciphers (ECC, Diffie-Hellman, etc), symmetric ciphers (AES, DES, etc), and hashing algorithms (MD5, SHA256, etc)  Experience with Snort rules language  Experience with intrusion detection or forensic analysis  Bachelor’s degree in Computer Science, Cyber Security, or other tech-related degree "
