,CATEGORY,COMPANY,TITLE,QUALIFICATIONS
240,Data Scientist/Data Analyst,Google," Senior Staff Software Engineer, Infrastructure, Google Cloud Storage ","Bachelor's degree or equivalent practical experience.8 years of experience in software development, and with data structures/algorithms.7 years of experience building and developing large-scale infrastructure, distributed systems, networks, and/or experience with compute technologies, storage, and/or hardware architecture.5 years of experience with design and architecture; and testing/launching software products.. Master’s degree or PhD in Engineering, Computer Science, or a related technical field.5 years of experience in a technical leadership role leading project teams and setting technical direction.3 years of experience working in a complex, matrixed organization involving cross-functional, and/or cross-business projects."
241,Data Scientist/Data Analyst,Google," Tech Lead, Biometric Sensor, Pixel ","Bachelor's degree in Computer Science, Electrical Engineering, a related technical field, or equivalent practical experience8 years of relevant experience, including development, testing, and deployment of embedded systemsExperience in Android HAL, Kernel device drivers development, and working on embedded systems software or firmware developmentExperience in C or C++ programming. Experience working with Quality AssuranceUnderstanding of Android frameworkFamiliarity with low level systems interacting with hardware/sensors"
242,Data Scientist/Data Analyst,Google," Staff Software Engineer, AR ","Bachelor's degree or equivalent practical experience.8 years of experience in software development, and with data structures/algorithms.5 years of experience testing, and launching software products, and 3 years of experience with software design and architecture. . Master’s degree or PhD in Engineering, Computer Science, or a related technical field.3 years of experience in a technical leadership role leading project teams and setting technical direction.3 years of experience working in a complex, matrixed organization involving cross-functional, and/or cross-business projects."
243,Data Scientist/Data Analyst,Google," Staff Software Engineer, Technical Lead, Google Cloud ","Bachelor's degree in Computer Science or a related technical field or equivalent practical experience. Experience in a people management, supervision/team leadership role.Experience in a technical leadership role.Experience in one or more programming languages (e.g.,Python, Perl, C, C++ or Java).. Experience in tech stack such as Angular, Java, Kubernetes, Cloud, TypeScript, Leadership, and Full-Stack Development.Experience in architecting and developing software or infrastructure for scalable, high performance, and distributed systems.Experience in front-end, back-end, Kubernetes, and Google Cloud."
244,Data Scientist/Data Analyst,Google," Telco Principal Architect, Google Cloud ","12 years of experience as an enterprise architect in a cloud computing environment or a customer-facing role.Experience in cloud computing (e.g., applications, infrastructure, storage, platforms, data), cloud market, and competitive dynamics.Experience in Telco Industry with any one of the area around core telecommunications IT CRM, BSS, OSS, digital/data transformation.. Experience in applying industry standards defined by bodies like TMForum, ETSI, and 3GPP to drive standardized enterprise architectures and interworking in telecommunication specific domain solutions.Experience with structured enterprise architecture practices, hybrid cloud deployments, and on-premise-to-cloud migration deployments and roadmaps.Experience with building, architecting, designing, and implementing highly distributed global cloud-based systems.Experience with network infrastructure, security, and application development.Knowledge of exposure to telecommunications Network Functions Virtualization (NFV), MANO and multi domain service orchestration and assurance.Knowledge of enterprise technology buying and evaluation process and large-scale computing solutions."
245,Data Scientist/Data Analyst,Google," SAP Application Engineer, Google Cloud ","Bachelor's degree in Computer Science or equivalent practical experience.7 years of experience in Advanced Business Application Programming (ABAP) and SAP development methodologies (e.g., Core Data Services, OO ABAP, OData, REST, enhancements/BADI’s).Experience in cloud-based SAP deployments, SAP products, technologies, and SAP Business Suite.Experience developing business applications, system integration, and IT development.. Experience in coding, implementing order-to-cash, Subscription Order Management (SOM), financials using SAP latest technologies, and working with several functional areas (e.g., SAP Sales and Distribution(SD), Billing and Revenue Innovation Management (BRIM), on-premise or cloud implementations of SAP, etc.).Experience implementing and customizing third-party software, building custom subscription order management or financial applications, and deploying machine automation solutions.Knowledge of SAP technical and domain (e.g., OTC, SOM, Finance, or Supply Chain), to solve complex business problems with simplified and integrated solutions across SAP, first-party, and third-party systems."
246,Data Scientist/Data Analyst,Google," Senior Staff Software Engineer, Immersive XR OS ","Bachelor's degree or equivalent practical experience8 years of experience in software development with data structures/algorithms, and experience with modern software development processes 5 years of experience with design and architecture; and testing/launching software productsExperience with operating systems architectures and building and shipping systems. Master's degree or PhD in Computer Science or related technical field7 years of experience working with embedded operating systems, and designing/implementing OS and application runtime components5 years of experience in a technical leadership role leading project teams and setting technical direction3 years of experience working in a complex, matrixed organization involving cross-functional, and/or cross-business projectsExperience with core android components Experience with OpenXR and OpenXR Extensions"
247,Data Scientist/Data Analyst,Google," Systems Development Engineer, Google Global Networking ","Experience with Linux/Unix administration and internals.Experience with troubleshooting across Linux and networking.Experience in automation and coding (e.g., Go, Javascript, Python, or other coding languages).. Experience in root-causing problems in networking, storage, operating systems, etc.Understanding of cloud technologies and enterprise compute environment.Understanding of internet peering/routing topologies (e.g., Border Gateway Protocol) and frontend development.Experience with coding projects with common programming/scripting languages such as Java, C, C++, Python, Shell scripting, and JavaScript."
248,Data Scientist/Data Analyst,Google," Software Engineer, Google Cloud ","Bachelor’s degree or equivalent practical experience.1 year of experience with software development in one or more programming languages (e.g., Python, C, C++, Java, JavaScript).. Master's degree or PhD in Computer Science or related technical field.Experience developing accessible technologies."
249,Data Scientist/Data Analyst,Google," Application Modernization Engineer, Global Delivery Center, Google Cloud ","Bachelor's degree in Computer Science, a related technical field, or equivalent practical experience.5 years of experience as a software developer.Experience in designing/architecting APIs and containerized applications.Experience in troubleshooting clients technical issues, and working with Engineering teams and customers.. Experience in applying professional software engineering practices for the full system development life cycle (i.e., coding standards and reviews, source control management, build processes, testing and operations).Experience in architecting scalable, distributed public cloud solutions across SaaS, PaaS, and IaaS.Experience in cloud migration projects, across hybrid or multi-cloud environments.Experience in coaching and mentoring technical teams.Ability to effectively communicate outlook, architecture, and complex technical concepts to technical and non-technical audiences."
250,Data Scientist/Data Analyst,Google," Staff Software Engineer, Google Cloud ","Bachelor's degree or equivalent practical experience.8 years of experience in software development, and with data structures/algorithms.5 years of experience testing, and launching software products, and 3 years of experience with software design and architecture. . Master’s degree or PhD in Engineering, Computer Science, or a related technical field.3 years of experience in a technical leadership role leading project teams and setting technical direction.3 years of experience working in a complex, matrixed organization involving cross-functional, and/or cross-business projects."
251,Data Scientist/Data Analyst,Google," Software Engineer, Systems Power and Performance ","Master's degree in Electrical Engineering, Computer Engineering, or Computer Science, with emphasis on computer architecture and performance/power analysis or equivalent practical experience5 years of experience in power or performance modeling or systems performance analysisExperience working with cross-functional teams including product management, chip architecture, hardware implementation, and embedded software teams. PhD in Electrical Engineering, Computer Engineering, or Computer Science, with emphasis on computer architecture and performance/power analysisExperience with Android OSExperience with programming languages (e.g. Python)Knowledgeable on system software components, such as Linux, drivers, and runtimeKnowledge of the impact of software and architectural design decisions on power and thermal behavior of the system (e.g., thermal mitigation and scheduling, cross-layer policy design)Excellent performance analysis skills "
252,Data Scientist/Data Analyst,Google," Embedded Software Engineer, Multimedia, Silicon ","5 years of experience with embedded programming in C/C++.Experience with Android/Wear operating system platform on mobile SoC.Experience in developing and troubleshooting Android multimedia (audio, video, camera and graphics) software on SoC.. Bachelor's degree or Master's in Electrical Engineering, Computer Engineering, or Computer Science, with emphasis on computer architecture and performance/power analysis.Experience working with cross-functional teams including product management, chip architecture, hardware implementation and embedded software teams.Experience with Android framework development,mobile platforms, Android performance optimization and tuning.Experience in Computer Science, with strong competencies in data structures, algorithms, and software design.Experience with Platform/SoC bringup.Ability to solve complex and ambiguous problems."
253,Data Scientist/Data Analyst,Google," Senior Software Engineer, Technical Infrastructure ","Bachelor’s degree or equivalent practical experience.5 years of experience with software development in one or more programming languages, and with data structures/algorithms.3 years of experience testing, maintaining, or launching software products, and 1 year of experience with software design and architecture.. Master's degree or PhD in Computer Science or related technical field.1 year of experience in a technical leadership role.Experience developing accessible technologies."
254,Data Scientist/Data Analyst,Google," Staff Software Engineer, Infrastructure, Google Cloud Compute ","Bachelor's degree or equivalent practical experience.8 years of experience in software development, and with data structures/algorithms.5 years of experience testing, and launching software products, and 3 years of experience with software design and architecture. 5 years of experience building and developing large-scale infrastructure, distributed systems or networks, and/or experience with compute technologies, storage, and/or hardware architecture.. Master’s degree or PhD in Engineering, Computer Science, or a related technical field.3 years of experience in a technical leadership role leading project teams and setting technical direction.3 years of experience working in a complex, matrixed organization involving cross-functional, and/or cross-business projects."
255,Data Scientist/Data Analyst,Google," Application Engineer, Cloud Supply Chain "," 6 years of experience in systems integrationExperience with Java, JavaScript, Python, Go, C++, or similar languageExperience with leading development teams that develop custom software solutions and integrations in the supply chain domainExperience interfacing with third-party Enterprise Resource Planning applications and developing custom UI experiences. Master's degree in Computer Science or related technical field10 years of experience with Java, Python, Go, JavaScript, C++, or similar language5 years of experience leading technical or engineering resources as a team leadExperience working with Supply Chain Management, Machine Learning, Artificial Intelligence or ERP SystemsAbility to learn and drive implementation and ideation of solutions using technologies like AI/ML, iPaaS and other cloud technologies"
256,Data Scientist/Data Analyst,Google," Software Engineer, Embedded Security ","Bachelor's degree in computer science or equivalent practical experience.4 years of experience in software development.Experience in data structures, algorithms, and software design.Experience with Advanced Risc Machine or other low-power SoC architectures.. Experience with interface protocols (e.g., USB, SPI, I2C, UART, UFS, PCIe), Software stacks, Drivers, and System Memory Drivers.Experience with performance analysis and optimization.Knowledge of the fundamentals of Bootloaders, SoC low power management, and security frameworks.Knowledge of embedded systems.Knowledge of ARM Trusted Execution Environment/Intel SGX, ARM or x86 assembly, system BIOS, Linux kernel, and device drivers.Knowledge of development, RTOS concepts, device drivers, and hardware/software integration."
257,Data Scientist/Data Analyst,Google," Systems Development Engineer, Google Distributed Cloud, Hosted ","Bachelor's degree or equivalent practical experience. 5 years of experience in network and/or Linux system administration, web or software development, and troubleshooting.Experience in scripting, writing, and modifying code to improve monitoring and automation (e.g., Perl, Python, Shell).. Experience in root-cause problems in networking, storage, operating systems, etc.Experience in virtualization and cloud hosting.Knowledge of Operating System internals, L2/L3/L4 networking, and storage appliance internals.Understanding of cloud technologies and enterprise compute environment."
258,Data Scientist/Data Analyst,Google," Technical Lead, Pixel Mobile Wireless ","Bachelor's degree in Computer Science, Communications, Electric Engineering, Statistics, technical field, or equivalent practical experience5 years of experience in building and launching software or Internet systemsExperience in one or more of the following: System Design, Data Structure, Algorithms, Statistical ModelingExperience in one or more of the following: C++, Python, Java, Go. Experience in Wireless Communications, especially in Modem Hardware/Software, Third Generation Partnership Project (3GPP), or Carrier CertificationExperience developing tools for professional usersExperience in system Software Development on Embedded SystemsExperience with business process improvement and automationExperience in front-end technologies (e.g., Angular)"
259,Data Scientist/Data Analyst,Google," Staff Software Engineer, Mobile, Android ","Bachelor's degree or equivalent practical experience.8 years of experience in software development, and with data structures/algorithms.5 years of experience with design and architecture; and testing/launching software products.7 years of experience with Android application development.. Master’s degree or PhD in Engineering, Computer Science, or a related technical field.5 years of experience in a technical leadership role leading project teams and setting technical direction.3 years of experience working in a complex, matrixed organization involving cross-functional, and/or cross-business projects."
260,Data Scientist/Data Analyst,Google," Software Engineer, Android Permissions ","Bachelor's degree or equivalent practical experience.8 years of experience in software development, and with data structures/algorithms.5 years of experience testing, and launching software products, and 3 years of experience with software design and architecture.Experience with Java and operating systems. Master’s degree or PhD in Engineering, Computer Science, or a related technical field.3 years of experience in a technical leadership role leading project teams and setting technical direction.3 years of experience working in a complex, matrixed organization involving cross-functional, and/or cross-business projects.No prior Android experience is required, but experience leading projects across multiple orgs is desirable."
261,Data Scientist/Data Analyst,Google," Data Scientist Intern, PhD, Summer 2023 ","Currently pursuing a PhD degree in a quantitative discipline (e.g., statistics, biostatistics, physics, applied mathematics, operations research, economics).Experience with statistical methods (linear models, multivariate analysis, stochastic processes, sampling methods, etc.).Experience with data analysis.Experience using R or Python and technology to work with datasets such as scripting or statistical software (R, SAS, etc.).. Currently attending a degree program in the US with plans to return to the degree program after completion of the internship.Anticipated graduation on or before June 2024.Available to work full time for a minimum of 12 weeks outside of university term time.Ability to draw conclusions from data and recommend actions.Ability to take on a leadership role and take initiative. Interest in teach others and learn new techniques."
262,Data Scientist/Data Analyst,Google," Software Developer Intern, PhD, Summer 2023 ","Pursuing a PhD degree program in Computer Science, or related technical field.Experience programming in one or more of the following: C/C++, Java, or Python.. Currently attending a degree program in Canada and available to work full time for a minimum of 12 weeks outside of university term time.Returning to a degree program after completion of the internship.Experience in computer science, with knowledge in data structures, algorithms, and software design. Programming experience in one or more of the following: C/C++, C#, Java, JavaScript, Python Objective C, Go, or similar.Research experience in Algorithms, Architecture, Artificial Intelligence, Compilers, Database, Data Mining, Distributed Systems, Machine Learning, Networking, or Systems."
263,Data Scientist/Data Analyst,Google," Software Engineering Intern, PhD, Summer 2023 ","Pursuing a PhD degree program in Computer Science, or related technical field.Experience programming in one or more of the following: C/C++, Java, or Python.. Research experience in Algorithms, Architecture, Artificial Intelligence, Compilers, Database, Data Mining, Distributed Systems, Machine Learning, Networking or Systems.Currently attending a degree program in the US with plans to return to the degree program after completion of the internship.Available to work full time for a minimum of 12 weeks outside of university term time.Programming experience in one or more of the following: C/C++, C#, Java, JavaScript, Python Objective C, Go, or similar.Experience in computer science, with knowledge in data structures, algorithms, and software design."
264,Data Scientist/Data Analyst,Google," Software Engineering Intern, 2023 ","Currently pursuing a Bachelor’s, Master's, or PhD degree in Computer Science or related technical field.Experience in Software Development and coding in a general-purpose programming language (e.g., Java, C/C++, C#, Objective C, Python, JavaScript, Go, etc.).. Ability to showcase tech projects and participate in computer science-related extracurricular activities."
265,Data Scientist/Data Analyst,Google," Research Intern, PhD, Summer 2023 ","Currently enrolled in a PhD degree in Computer Science, Linguistics, Statistics, Biostatistics, Applied Mathematics, Operations Research, Economics, Natural Sciences, or related technical field.Experience in one area of computer science (e.g., Natural Language Understanding, Computer Vision, Machine Learning, Deep Learning, Algorithmic Foundations of Optimization, Quantum Information Science, Data Science, Software Engineering, or similar areas).. Currently attending a degree program in the US and available to work full time for a minimum of 12 weeks outside of university term time.Anticipated graduation by December 2023 or returning to a degree program after completion of the internship.Experience as a researcher, including internships, full-time, or at a lab.Experience contributing research communities or efforts, including publishing papers in major conferences or journals.Experience with one or more general purpose programming languages (e.g., Python, Java, JavaScript, C/C++, etc.).Ability to speak and write in English fluently."
266,Data Scientist/Data Analyst,Google," Research Intern, PhD, Summer 2023 ","Currently enrolled in a PhD degree in Computer Science, Linguistics, Statistics, Biostatistics, Applied Mathematics, Operations Research, Economics, Natural Sciences, or a related technical field.Experience in one area of computer science (e.g., Natural Language Understanding, Computer Vision, Machine Learning, Deep Learning, Algorithmic Foundations of Optimization, Quantum Information Science, Data Science, Software Developing).. Currently attending a degree program in Canada and available to work full time for a minimum of 12 weeks outside of university term time.Anticipated graduation by December 2023 or returning to a degree program after completion of the internship.Experience contributing research communities or efforts, including publishing papers in major conferences or journals.Experience with one or more general purpose programming languages.Experience with one or more general purpose programming languages (e.g., Python, Java, JavaScript, C/C++, etc.).Ability to speak and write in English fluently."
267,Data Scientist/Data Analyst,Google," Director, Engineering, Search Analytics Data Warehouse ","Bachelor’s degree in Computer Science, Engineering, or equivalent practical experience.15 years of engineering experience, including 10 years of experience leading engineering teams building user-facing products, technical infrastructure, and supporting data systems.Experience at global organizations with cross-functional, product, or engineering elements.Experience managing multiple stakeholders and completing projects.. Ability to analyze organizational issues, technical matters, or data analysis in order to draw insights, steer, and coach teams in the right direction.Ability to influence at all levels of the organization.Ability to foster innovation by leading teams with a growth mindset of experimentation, learning, and iteration.Ability to commit to continuously improving engineering development practices and processes.Open, engaging, and collaborative style, with the ability to represent and respect Google values in all interactions, with excellent global leadership, organizational, and communication skills.Comfortable with ambiguity and change management."
268,Data Scientist/Data Analyst,Google," Student Researcher, PhD, 2023 ","Currently enrolled in a PhD in Computer Science, Linguistics, Statistics, Biostatistics, Applied Mathematics, Operations Research, Economics, or Natural Sciences.Experience in one area of computer science (e.g., Natural Language Understanding, Computer Vision, Machine Learning, Deep Learning, Algorithmic Foundations of Optimization, Quantum Information Science, Data Science, Software Engineering, etc.).. Currently attending a degree program in the US.Currently enrolled in a full-time degree program and returning to the program after completion of the internship.Experience as a researcher, including internships, full-time, or at a lab.Experience contributing to research communities or efforts, including publishing papers in conferences or journals.Experience with one or more general purpose programming languages (e.g., C/C++, Java, MATLAB, Go, Python, etc.).Ability to speak and write in English fluently."
269,Data Scientist/Data Analyst,Google," Student Researcher, BS, 2023 ","Currently enrolled in a Bachelor's degree in Computer Science, Linguistics, Statistics, Biostatistics, Applied Mathematics, Operations Research, Economics, or Natural Sciences.Experience in one area of computer science (e.g., Natural Language Understanding, Computer Vision, Machine Learning, Deep Learning, Algorithmic Foundations of Optimization, Quantum Information Science, Data Science, Software Engineering, etc.).. Currently enrolled in a full-time degree program and returning to the program after completion of the internship.Currently attending a degree program in Canada.Experience as a researcher, including internships, full-time, or at a lab.Experience contributing to research communities or efforts, including publishing papers in conferences or journals.Experience with one or more general purpose programming languages (e.g., C/C++, Java, MATLAB, Go, Python, etc.).Ability to speak and write in English fluently."
